,concepts,description,related
557,Corallimorphus,Corallimorphus is a genus of colonial anthozoans similar in appearance to sea anemones and in body format to scleractinian stony corals. These animals are cnidarians in the family Corallimorphidae.,"Corallimorphus niwa, Corallimorphus profundus, Corallimorpharia, Corallimorphidae, Thomas Alan Stephenson"
558,Corallimorphus denhartogi,Corallimorphus is a genus of colonial anthozoans similar in appearance to sea anemones and in body format to scleractinian stony corals. These animals are cnidarians in the family Corallimorphidae.,Corallimorphus
559,Corallimorphus pilatus,Corallimorphus is a genus of colonial anthozoans similar in appearance to sea anemones and in body format to scleractinian stony corals. These animals are cnidarians in the family Corallimorphidae.,Corallimorphus
560,Corallimorphus rigidus,Corallimorphus is a genus of colonial anthozoans similar in appearance to sea anemones and in body format to scleractinian stony corals. These animals are cnidarians in the family Corallimorphidae.,Corallimorphus
561,Corallistes,Corallistidae is a family of sea sponges.,"Corallistidae, 2016 in paleontology, List of prehistoric sponge genera, 2017 in paleontology"
562,Corallium,"Precious coral, or red coral, is the common name given to a genus of marine corals, Corallium. The distinguishing characteristic of precious corals is their durable and intensely colored red or pink-orange skeleton, which is used for making jewelry.","Precious coral, Corallium occultum, Strait of Sicily, Gemstones in the Bible, Ramaria formosa, List of species protected by CITES Appendix III, Unleash (EP), Ramaria stricta, Coralie, Province of Livorno"
563,Corbitella,Corbitella is a genus of glass sponges (Hexactinellids) belonging to the family Euplectellidae.,"Corbitella elegans, E. elegans, Euplectellidae, C. elegans (disambiguation)"
564,Corbitellinae,"Atlantisella is a genus of glass sponges (Hexactinellids) belonging to the family Euplectellidae, first described in 2002 by Konstantin Tabachnick.Species of this genus are found off the coast of New Zealand, in the central Pacific and off the west coast of the United States.","Atlantisella, Euplectellidae, Corbitella, List of sponges of South Africa"
565,Cordagalma,Cordagalmatidae is a family of cnidarians belonging to the order Siphonophorae.Genera:,"Cordagalmatidae, List of marine cnidarians of South Africa"
566,Corolla,,"Toyota Corolla, Petal, Toyota Corolla (E210), Toyota Corolla (E70), Toyota Corolla (E100), Toyota Auris, Toyota Corolla (E140), Toyota Corolla (E110), Toyota AE86"
567,Corolla spectabilis,"Corolla spectabilis, common name: spectacular corolla, is a species of sea butterfly, a floating and swimming sea snail in the family Cymbuliidae.","C. spectabilis, Corolla (gastropod), Senna spectabilis, Cymbulioidea, Acokanthera oblongifolia, Papaveraceae, Alstonia, Rauvolfia sumatrana, Tabebuia"
568,Coronaster,Coronaster is a genus of the Asteriidae family of starfish.,"Coronaster briareus, Asteriidae"
569,Coronaster halicepus,Coronaster is a genus of the Asteriidae family of starfish.,Coronaster
570,Coronatae,"Crown jellyfishes are the six families of true jellyfish that belong to the order Coronatae. They are distinguished from other jellyfish by the presence of a deep groove running around the umbrella, giving them the crown shape from which they take their name.","Crown jellyfish, Cephea, Atolla jellyfish, Helmet jellyfish, Jellyfish, Scyphozoa, Coronamedusae, Periphyllidae, Nausithoe aurea, Atolla reynoldsi"
571,Corymorpha,Corymorpha is a genus of hydrozoans in the family Corymorphidae.,"Corymorpha nutans, Corymorphidae, Steenstrupia, Tenellia punicea, Apata pricei, Joshua Alder, List of marine cnidarians of South Africa, List of cnidarians of Ireland"
572,Corymorpha sp.,The list of marine cnidarians of South Africa is a list of saltwater species that form a part of the cnidarian (Phylum Cnidaria) fauna of South Africa. This list does not include the freshwater cnidarians.,List of marine cnidarians of South Africa
573,Corymorphidae,"Corymorphidae is a family of hydroid cnidarians. For long placed in a presumed superfamily or infraorder Tubulariida of suborder Capitata, they are actually close relatives of the Hydridae and are now united with these and a number of relatives in a newly recognized suborder Aplanulata.","Corymorpha nutans, Euphysa, Steenstrupia, Corymorpha, Anthoathecata, Aplanulata, List of cnidarians of Ireland, Gonophore, List of marine cnidarians of South Africa"
574,Corynascidia,Corellidae is a family of sea squirts belonging to the order Phlebobranchia.,"Corellidae, Phlebobranchia"
575,Corynascidia sp.,"Phlebobranchia is an order of sea squirts in the class Ascidiacea, first described by Fernando Lahille in 1886.",Phlebobranchia
576,Coryphaenoides,"Coryphaenoides is a genus of rattails which is found in all oceans of the world. They are found in deep waters and C. yaquinae, recorded to 7,012 m (23,005 ft), is the only member in the family known from the hadal zone.The generic name means ""similar to Coryphaena"".","Abyssal grenadier, Coryphaenoides rupestris, Grenadiers (fish), Abyssal rattail, List of fishes of Great Britain, List of fish of Ireland, Coryphaenoides yaquinae, Coryphaenoides woodmasoni, Hypselecara coryphaenoides"
577,Coryphaenoides acrolepis,"Coryphaenoides is a genus of rattails which is found in all oceans of the world. They are found in deep waters and C. yaquinae, recorded to 7,012 m (23,005 ft), is the only member in the family known from the hadal zone.The generic name means ""similar to Coryphaena"".","Coryphaenoides, Biofoam, List of prehistoric bony fish genera, Deep-sea fish"
578,Coryphaenoides acrolepis-filifer complex,,
579,Coryphaenoides armatus,"The abyssal grenadier, Coryphaenoides armatus, is an abyssal fish of the genus Coryphaenoides, found in all the world's oceans, at depths between 800 and 4,000 metres (2,600 and 13,100 ft). Its adult length is 20 to 40 centimetres (8 to 16 in), although Fishbase gives lengths up to 1 metre (3 ft 3 in).","Abyssal grenadier, Coryphaenoides, Coryphaenoides yaquinae, Grenadiers (fish), Barbel (anatomy), Deep sea, Deep-sea fish, List of fishes of Great Britain, List of fish of Ireland, List of least concern fishes"
580,Coryphaenoides armatus-leptolepis-yaquinae complex,,
581,Coryphaenoides armatus-yaquinae complex,,Deep sea
582,Coryphaenoides capito,"Coryphaenoides is a genus of rattails which is found in all oceans of the world. They are found in deep waters and C. yaquinae, recorded to 7,012 m (23,005 ft), is the only member in the family known from the hadal zone.The generic name means ""similar to Coryphaena"".","Coryphaenoides, List of data deficient fishes, List of marine animals of the Cape Peninsula and False Bay"
583,Coryphaenoides filifer,"Coryphaenoides is a genus of rattails which is found in all oceans of the world. They are found in deep waters and C. yaquinae, recorded to 7,012 m (23,005 ft), is the only member in the family known from the hadal zone.The generic name means ""similar to Coryphaena"".","Coryphaenoides, List of Latin and Greek words commonly used in systematic names, List of data deficient fishes, List of marine animals of the Cape Peninsula and False Bay, List of marine bony fishes of South Africa"
584,Coryphaenoides leptolepis,"Coryphaenoides leptolepis, the ghostly grenadier, is a species of rattail found in the northern Atlantic and Pacific Oceans at depths of 610 to 4,000 metres (2,000 to 13,120 ft).  This species grows to a length of 62 centimetres (24 in) TL.","Leptolepis, Coryphaenoides, Grenadiers (fish), List of fish of Ireland, List of fishes of Great Britain, List of least concern fishes, Azilal Formation, Calcare di Sogno, Paleobiota of the Posidonia Shale"
585,Coryphaenoides longicirrhus,"Coryphaenoides is a genus of rattails which is found in all oceans of the world. They are found in deep waters and C. yaquinae, recorded to 7,012 m (23,005 ft), is the only member in the family known from the hadal zone.The generic name means ""similar to Coryphaena"".",Coryphaenoides
586,Coryphaenoides longifilis,"Coryphaenoides is a genus of rattails which is found in all oceans of the world. They are found in deep waters and C. yaquinae, recorded to 7,012 m (23,005 ft), is the only member in the family known from the hadal zone.The generic name means ""similar to Coryphaena"".","Coryphaenoides, List of least concern fishes, List of data deficient fishes"
587,Coryphaenoides sp.,"Noroit Seamount is a seamount in the Caribbean Sea, in the Anegada Passage.  It is also spelled Noroît Seamount after the French survey and research vessel RV Le Noroît (IMO number: 7035717) which was operated by IFREMER. It is also known as Noroit Knoll.","Noroit Seamount, Seamount, Davidson Seamount, Bathypodocotyle, List of critically endangered fishes, List of Latin and Greek words commonly used in systematic names, Baited remote underwater video, Syncoelicotyloides, List of marine animals of the Cape Peninsula and False Bay, IUCN Red List critically endangered species (Animalia)"
588,Coryphaenoides yaquinae,"The rough abyssal grenadier (Coryphaenoides yaquinae) is a species of deep-sea grenadier fish in the family Macrouridae. First described as a separate species in 1974, the rough abyssal grenadier was historically confused with its congener, Coryphaenoides armatus.","Coryphaenoides, Abyssal grenadier, Deep sea"
589,Cranchia,"Cranchia scabra is a species of glass squid. It is the only species in the genus, and is fairly small (about 150 mm).","Cranchia scabra, Histioteuthis bonnellii, Idiosepius minimus, Teuthowenia maculata, Teuthowenia megalops, Cranchiinae, Histioteuthis, Cranchiidae, Cranchioidea, Cephalopod dermal structures"
590,Cranchia scabra,"Cranchia scabra is a species of glass squid. It is the only species in the genus, and is fairly small (about 150 mm).","Cranchiinae, Cephalopod dermal structures, Teuthowenia megalops, List of least concern molluscs"
591,Cranchiidae,"The family Cranchiidae comprises the approximately 60 species of glass squid, also known as cockatoo squid, cranchiid, cranch squid, or bathyscaphoid squid. Cranchiid squid occur in surface and midwater depths of open oceans around the world.","Colossal squid, Gladius (cephalopod), Oegopsida, Taoniinae, Invertebrate, Helicocranchia pfefferi, Cuvier's beaked whale, Taonius, Parateuthis"
592,Craseoa,"Prayidae is a family of marine invertebrates in the order Siphonophorae. They are colonial, and the colonies can superficially resemble jellyfish; although they appear to be a single organism, each specimen is actually a colony of Siphonophora.","Prayidae, Dendrogramma"
593,Craseoa lathetica,,
594,Crateromorpha,"Paleontology or palaeontology is the study of prehistoric life forms on Earth through the examination of plant and animal fossils. This includes the study of body fossils, tracks (ichnites), burrows, cast-off parts, fossilised feces (coprolites), palynomorphs and chemical residues.","2019 in paleontology, Rossellidae, List of prehistoric sponge genera, List of sponges of South Africa"
595,Creseis,Creseis is a genus of gastropods belonging to the family Creseidae.The genus has cosmopolitan distribution.Species:,"Creseis virgula, Pteropoda, Cavoliniidae, Sander Rang, Hyalocylidae, Creseidae, 2012 in molluscan paleontology, List of marine heterobranch gastropods of South Africa, List of the Cenozoic life of Alabama"
596,Creseis virgula,Creseis virgula is a species of gastropods belonging to the family Creseidae. The larvae are zooplankton.,"Creseis, Pteropoda, Sander Rang, Cavoliniidae, List of marine heterobranch gastropods of South Africa"
597,Crinoidea,"Crinoids are marine animals that make up the class Crinoidea. Crinoids that are attached to the sea bottom by a stalk in their juvenile form are commonly called sea lilies, while the unstalked forms, called feather stars or comatulids, are members of the largest crinoid order, Comatulida.","Crinoid, Articulata (Crinoidea), Camerata (Crinoidea), Promachocrinus, Promachocrinus fragarius, Echinoderm, Ausichicrinites, Echmatocrinus, List of animal classes, Antedon"
598,Crossaster,Crossaster is a genus of sea stars in the family Solasteridae.,"Common sunstar, Solasteridae, Solaster stimpsoni, Common starfish, Rose sea star, List of animals of Long Island Sound, Ophiocomina nigra, Solaster endeca, List of echinoderms of Ireland"
599,Crossaster borealis,Crossaster is a genus of sea stars in the family Solasteridae.,"Crossaster, List of animals of Long Island Sound"
600,Crossota alba,Crossota alba is a species of hydrozoan in the family Rhopalonematidae. this species does not have sessile stage as other hydromedusae.,"Crossota, List of marine cnidarians of South Africa, Amphiura, List of moths of Australia (Geometridae), List of the Cenozoic life of Florida, List of Stelis species"
601,Crossota millsae,Crossota millsae is a species of deep-sea hydrozoan. These small ocean-dwelling creatures are bioluminescent; the light emitted by these jellyfish serves as a defense or warning to other creatures.,"Crossota, Crossota norvegica, Vampyrocrossota"
602,Crossota rufobrunnea,Crossota rufobrunnea is a species of hydrozoan.,"Crossota, List of Stelis species"
603,Crotalometra,Thalassometridae is a family of echinoderms belonging to the order Comatulida.,"Thalassometridae, List of crinoid genera"
604,Crustacea,"Crustaceans belong to the subphylum Crustacea (), and form a large, diverse group of arthropods including decapods, seed shrimp, branchiopods, fish lice, krill, remipedes, isopods, barnacles, copepods, opossum shrimps, amphipods and mantis shrimp. The crustacean group can be treated as a subphylum under the clade Mandibulata.","Crustacean, Lindernia crustacea, Calothrix crustacea, 2018 in arthropod paleontology, Pancrustacea, Decapoda, Mucilago, Carcinisation, Prawn, Barnacle"
605,Crypthelia,Stylasteridae is a family of hydrozoans.,"Stylasteridae, 2019 in paleontology"
606,Crypthelia kelleyi,,
607,Crystallophyes,Clausophyidae is a family of cnidarians belonging to the order Siphonophorae.Genera:,"Clausophyidae, María de los Ángeles Alvariño González, List of marine cnidarians of South Africa"
608,Crystallophyes amygdalina,"María de los Ángeles Alvariño González (Spanish pronunciation: [maˈɾia ðe los ˈaŋxeles alβaˈɾiɲo ɣonˈθaleθ], October 3, 1916 – May 29, 2005), known as Ángeles Alvariño, was a Spanish fishery research biologist and oceanographer globally recognized as an authority in plankton biology. She was the first woman ever appointed as scientist aboard any British or Spanish exploration ship.","María de los Ángeles Alvariño González, List of marine cnidarians of South Africa"
609,Ctenophora,"Ctenophora (; SG: ctenophore ; from Ancient Greek  κτείς (kteis) 'comb', and  φέρω (pherō) 'to carry') comprise a phylum of marine invertebrates, commonly known as comb jellies, that inhabit sea waters worldwide. They are notable for the groups of cilia they use for swimming (commonly referred to as ""combs""), and they are the largest animals to swim with the help of cilia.","Ctenophora (fly), Ctenophora ornata, Ctenophora festiva, ParaHoxozoa, Ctenophora nubecula, Coelenterata, Animal, Ctenophora elegans, Ctenophora apicata"
610,Ctenophore,"Ctenophora (; SG: ctenophore ; from Ancient Greek  κτείς (kteis) 'comb', and  φέρω (pherō) 'to carry') comprise a phylum of marine invertebrates, commonly known as comb jellies, that inhabit sea waters worldwide. They are notable for the groups of cilia they use for swimming (commonly referred to as ""combs""), and they are the largest animals to swim with the help of cilia.","Ctenophora, Lampea (ctenophore), Lobata, Ganesha (ctenophore), Beroe (ctenophore), Lesueuria (ctenophore), Callianira (ctenophore), Cydippe (ctenophore), Fasciculus, Velamen parallelum"
611,Ctenophoricola,,
612,Culeolus,Culeolus is a genus of ascidian tunicates in the family Pyuridae.,"Culeolus elegans, Pyuridae, John Murray (oceanographer), Stolidobranchia, C. elegans (disambiguation)"
613,Culeolus barryi,Culeolus is a genus of ascidian tunicates in the family Pyuridae.,Culeolus
614,Culeolus recumbens,Culeolus is a genus of ascidian tunicates in the family Pyuridae.,Culeolus
615,Culeolus sp. 2,,
616,Cunina,"In ancient Roman religion, birth and childhood deities were thought to care for every aspect of conception, pregnancy, childbirth, and child development. Some major deities of Roman religion had a specialized function they contributed to this sphere of human life, while other deities are known only by the name with which they were invoked to promote or avert a particular action.","List of Roman birth and childhood deities, Cunina (hydrozoan), Eupithecia cunina, Phiala cunina, Cuninidae, Genius (mythology), Libation, Masiphya, Nertera granadensis, Indo-European vocabulary"
617,Cupressopathes,"Antipatharians, also known as black corals or thorn corals, are an order of soft deep-water corals. These corals can be recognized by their jet-black or dark brown chitin skeletons, surrounded by the polyps (part of coral that is alive).","Black coral, Myriopathidae"
618,Cupressopathes abies,,
619,Cyathidium,,"Saussurea, Holopodidae, List of crinoid genera, Jacques Forest, List of prehistoric echinoderm genera"
620,Cyclosalpa,,"Salp, Cyclosalpa, Cyclosalpa bakeri, Thalia (tunicate), Thaliacea, Clavelina minuta, Largest and heaviest animals, Thetys (tunicate), Myrtle E. Johnson, Vermes in the 10th edition of Systema Naturae"
621,Cyclothone,"A cyclotron is a type of particle accelerator invented by Ernest Lawrence in 1929–1930 at the University of California, Berkeley, and patented in 1932. A cyclotron accelerates charged particles outwards from the center of a flat cylindrical vacuum chamber along a spiral path.","Cyclothone signata, Gonostomatidae, Cyclothone alba, Cyclothone obscura, Cyclothone braueri, Cyclothone livida, Cyclothone atraria, Cyclothone acclinidens, Cyclothone pseudopallida"
622,Cyclothone pallida,"Cyclothone pallida, commonly known as the tan bristlemouth, is a species of ray-finned fish in the genus Cyclothone.","Cyclothone, Cyclothone parapallida, C. pallida, List of marine animals of the Cape Peninsula and False Bay, List of least concern fishes, List of marine bony fishes of South Africa, List of the Cenozoic life of California"
623,Cyclothone parapallida,"Cyclothone pallida, commonly known as the shadow bristlemouth, is a species of ray-finned fish in the genus Cyclothone.","Cyclothone, List of least concern fishes"
624,Cydippida,"Cydippida is an order of comb jellies. They are distinguished from other comb jellies by their spherical or oval bodies, and the fact their tentacles are branched, and can be retracted into pouches on either side of the pharynx.","Pleurobrachia, Ctenophora, Lobata, Tentacle, Haeckeliidae, Euplokamis dunlapae, Tentaculata, Pleurobrachiidae, Pleurobrachia pileus"
625,Cydippida 2,"Cydippida is an order of comb jellies. They are distinguished from other comb jellies by their spherical or oval bodies, and the fact their tentacles are branched, and can be retracted into pouches on either side of the pharynx.","Cydippida, Euplokamis dunlapae, Lobata, Ctenophora, Tentacle, Euplokamis, Mertensia ovum, Pleurobrachia pileus, Platyctenida, Euplokamis stationis"
626,Cyema atrum,Cyema atrum is a species of deep-water bobtail snipe eel in the family Cyematidae. It is the only member of its genus Cyema.,"Cyema, Snipe eel, Leptocephalus, Bobtail snipe eel, Opisthoproctus, Neocyema, List of least concern fishes, List of marine animals of the Cape Peninsula and False Bay, List of marine bony fishes of South Africa"
627,Cyllometra manca,"This list of crinoid genera is an attempt to create a comprehensive listing of all genera that have ever been considered to be crinoids, excluding purely vernacular terms. The list includes all commonly accepted genera, but also genera that are now considered invalid, doubtful (nomina dubia), or were not formally published (nomina nuda), as well as junior synonyms of more established names, and genera that are no longer considered crinoids.",List of crinoid genera
628,Cypraeidae,"Cypraeidae, commonly named the cowries (SG cowry), is a taxonomic family of small to large sea snails. These are marine gastropod mollusks in the superfamily Cypraeoidea, the cowries and cowry allies.","Cowrie, Cypraea tigris, List of marine molluscs of Sri Lanka, Cribrarula esontropia, Austrasiatica langfordi, Raybaudia, Macrocypraea cervinetta, Cypraea, Vicetia"
629,Cyrtomaia smithi,,
630,Cystechinus giganteus,,
631,Cystechinus loveni,,
632,Cystisoma,Cystisoma  is a genus of amphipod. It is the only member of the family Cystisomatidae within the Hyperiidea.,"Hyperiidea, Cyclopygidae, Pricyclopyge"
633,Cystocrepis setigera,"The pourtalesiids (Pourtalesiidae) are a family of irregular sea urchins that live in the deep sea. They are secondarily bilateral-symmetrical and like other representatives of the taxon Holasteroida they lack the lantern of Aristotle, which is typical for many other sea urchins.",Pourtalesiidae
634,Cyttomimus,Cyttomimus is a genus of zeniontid fishes native to the Pacific Ocean.,"Zeniontidae, Zeidae"
635,Cyttopsis rosea,"Cyttopsis rosea, the rosy dory, is a zeiform fish which is found on the continental slopes in most parts of the Atlantic and Pacific Oceans. It growth up to 22 cm and feeds on other fishes and on swimming crustaceans.","Cyttopsis, Parazenidae, List of least concern fishes, List of fishes of India, List of marine spiny-finned fishes of South Africa"
636,Decapoda,"The Decapoda or decapods (literally ""ten-footed"") are an order of crustaceans within the class Malacostraca, including many familiar groups, including crabs, lobsters, crayfish, shrimp, and prawns. Most decapods are scavengers.","2018 in arthropod paleontology, Crab, Carcinisation, Terrestrial crab, Anomura, Axiidea, Caridea, Coconut crab, Crustacean"
637,DeepPIV 1.0,Particle image velocimetry (PIV) is an optical method of flow visualization used in education and research.  It is used to obtain instantaneous velocity measurements and related properties in fluids.,"Particle image velocimetry, Sexual penetration, Larvacean, Stall (fluid dynamics), Stokes number, Arch of Titus, List of Super Nintendo Entertainment System games, Ocean optics, Hud (1963 film), Augustus"
638,DeepPIV 2.0,Particle image velocimetry (PIV) is an optical method of flow visualization used in education and research.  It is used to obtain instantaneous velocity measurements and related properties in fluids.,"Particle image velocimetry, Larvacean, Stall (fluid dynamics), Arch of Titus, List of Super Nintendo Entertainment System games, Hud (1963 film), Ocean optics, List of gestures, Augustus, Maximinus Thrax"
639,DeepPIV 3.0,Particle image velocimetry (PIV) is an optical method of flow visualization used in education and research.  It is used to obtain instantaneous velocity measurements and related properties in fluids.,"Particle image velocimetry, Sexual penetration, Larvacean, Stall (fluid dynamics), Arch of Titus, List of Super Nintendo Entertainment System games, Stokes number, Augustus, Hud (1963 film), Ocean optics"
640,Deepstaria,"Deepstaria is a genus of jellyfish known for their thin, sheet-like bodies. The genus is named after the Deep Star 4000, which collected the holotype of the type species, D. enigmatica.","Deepstaria enigmatica, Deepstaria reticulum, Ulmaridae"
641,Deepstaria enigmatica,Deepstaria enigmatica is a very rarely seen giant jellyfish of the family Ulmaridae first described in 1967 by F. S. Russell.,"Deepstaria, Deepstaria reticulum"
642,Deepstaria reticulum,"Deepstaria reticulum, is a jellyfish of the family Ulmaridae. It was described by Larson, Madin, and Harbison in 1988.",Deepstaria
643,Deimatidae,Deimatidae is a family of sea cucumbers belonging to the clade Synallactida.,"Sea cucumber, Synallactida, Oneirophanta mutabilis, Psychropotidae"
644,Deiopea,,"Deiopea (mythology), Deiopea kaloktenota, Nereids, Robinsonia deiopea, Eurhamphaeidae, Aeneid, Ephyra (mythology), 184 Dejopeja, Nymph"
645,Delectopecten,Delectopecten is a genus of bivalve molluscs within the family Pectinidae.,"Scallop, 2023 in paleomalacology, List of marine molluscs of Ireland (Bivalvia), List of the Cenozoic life of Oregon, List of the Cenozoic life of California, List of the Cenozoic life of Washington"
646,Democrinus japonicus,,
647,Demospongiae,"Demosponges (Demospongiae) are the most diverse class in the phylum Porifera. They include 76.2% of all species of sponges with nearly 8,800 species worldwide (World Porifera Database).","Demosponge, Sponge, Spongia officinalis, Svenzea zeai, Sponge spicule, Chondrocladia lyra, Siliceous sponge, SpongeBob SquarePants, Cnidaria, Cambrian"
648,Demospongiae sp. 1,"Demosponges (Demospongiae) are the most diverse class in the phylum Porifera. They include 76.2% of all species of sponges with nearly 8,800 species worldwide (World Porifera Database).","Demosponge, Sponge spicule, Sponge, Steve O'Shea, Tethya leysae, List of model organisms, Geodia barretti, List of freshwater fauna of Sri Lanka, Rossella antarctica, Haliclona caerulea"
649,Dendronotus patricki,"Dendronotus patricki is a species of sea slug, a dendronotid nudibranch, a shell-less marine gastropod mollusc in the family Dendronotidae.","Dendronotus, Dendronotidae, List of gastropods described in 2011"
650,Dendropathes,Schizopathidae is a family of corals belonging to the order Antipatharia.,"Schizopathidae, Black coral"
651,Dendropathes bacotaylorae,,
