,concepts,description,related
1150,Kumba sp.,"Anglo American plc is a British multinational mining company with headquarters in London, England. It is the world's largest producer of platinum, with around 40% of world output, as well as being a major producer of diamonds, copper, nickel, iron ore, polyhalite and steelmaking coal.","Anglo American plc, September 14, Spider web, List of loanwords in Malayalam, Debswana, List of data deficient fishes, List of Indic loanwords in Indonesian, List of sister cities in the United States, Waghi Tumbe, Deaths in April 2014"
1151,Kuronezumia,Kuronezumia is a genus of rattails.,"Grenadiers (fish), List of least concern fishes, List of marine animals of the Cape Peninsula and False Bay"
1152,Laemonema rhodochir,Laemonema is a genus of morid cods.,"Laemonema, List of least concern fishes"
1153,Laemonema robustum,Laemonema is a genus of morid cods.,"Laemonema, List of data deficient fishes, List of least concern fishes"
1154,Laetmogone,Eunoe laetmogonensis is a scale worm known from the north-east Atlantic Ocean at depths of about 800 to 2300 m.,"Eunoe laetmogonensis, Laetmogonidae"
1155,Laetmogone wyvillethomsoni,,
1156,Laetmogonidae,Laetmogonidae is a family of sea cucumbers.,"Sea cucumber, Elasipodida, Pannychia moseleyi, Psychropotidae"
1157,Laganidae,Laganidae is a family of echinoderms belonging to the order Clypeasteroida.,"Sand dollar, List of echinoderms of Sri Lanka, Echinarachnius parma, Neognathostomata, List of marine animals of Australia (temperate waters)"
1158,Lagenorhynchus obliquidens,"The Pacific white-sided dolphin (Lagenorhynchus obliquidens), also known as the hookfin porpoise, is an active dolphin found in the cool or temperate waters of the North Pacific Ocean.","Pacific white-sided dolphin, Lagenorhynchus, Oceanic dolphin, False killer whale, White-beaked dolphin, Atlantic white-sided dolphin, Peale's dolphin, List of cetaceans, Dolphin, Toothed whale"
1159,Lagrangian sediment trap,"Sediment traps are instruments used in oceanography and limnology to measure the quantity of sinking particulate organic (and inorganic) material in aquatic systems, usually oceans, lakes, or reservoirs.  This flux of material is the product of biological and ecological processes typically within the surface euphotic zone, and is of interest to scientists studying the role of the biological pump in the carbon cycle.Sediments traps normally consist of an upward-facing funnel that directs sinking particulate matter (e.g.","Sediment trap, Environmental DNA, Lagrangian Ocean Analysis, OceanParcels, Mahakam River, Sun, Plastic pollution in the Mediterranean sea, Particulates"
1160,Lamellibrachia,"Lamellibrachia is a genus of tube worms related to the giant tube worm, Riftia pachyptila. They live at deep-sea cold seeps where hydrocarbons (oil and methane) leak out of the seafloor, and are entirely reliant on internal, sulfide-oxidizing bacterial symbionts for their nutrition.","Lamellibrachia luymesi, Lamellibrachia columna, Lamellibrachia satsuma, Tube worm, Lamellibrachia barhami, Siboglinidae, Cold seep, Polychaete, List of longest-living organisms"
1161,Laminariales,,"Kelp, Brown algae, Macrocystis, Laminaria, Edible seaweed, Nereocystis, Wakame, Bull kelp, Saccharina japonica, Kombu"
1162,Lamoha,"The family Homolidae, known as carrier crabs or porter crabs, contains 14 genera of marine crabs. They mostly live on the continental slope and continental shelf, and are rarely encountered.",Homolidae
1163,Lamoha longirostris,,
1164,Lamoha williamsi,,
1165,Lampocteis cruentiventer,"Lampocteis is a monotypic genus of comb jellies, the only genus in family Lampoctenidae. The sole species in this new genus is Lampocteis cruentiventer, the bloodybelly comb jelly.","Lampocteis, Bloody (disambiguation), List of invertebrates of California"
1166,Lamprogrammus,Lamprogrammus is a genus of cusk-eels.,"Lamprogrammus niger, Cusk-eel, Lamprogrammus exutus, Lamprogrammus shcherbachevi, Lamprogrammus fragilis, Lamprogrammus brunswigi, List of largest fish, Ophidiiformes, Manzanilla Formation"
1167,Lamprogrammus brunswigi,Lamprogrammus brunswigi is a species of fish in the family Ophidiidae.,"Lamprogrammus, List of least concern fishes"
1168,Lanceolidae,Lanceolidae is a family of amphipods belonging to the order Amphipoda.Genera:,"Thomas Say, Hyperiidea, List of crustaceans of Ireland"
1169,Lanuginella,Lanuginellinae is a subfamily of glass sponges belonging to the family Rossellidae.,"Lanuginellinae, Rossellidae"
1170,Laqueus,"Laqueus is a genus of brachiopods belonging to the family Laqueidae.The species of this genus are found in Japan, Northern America.","Garrote, Sinezona laqueus, List of brachiopod species, Lasso, Lace, Laquearius, Siganus stellatus, Taxonomy of the Brachiopoda, List of Roman gladiator types"
1171,Laqueus californicus,"Laqueus is a genus of brachiopods belonging to the family Laqueidae.The species of this genus are found in Japan, Northern America.","Laqueus, Octopus (genus), List of invertebrates of California"
1172,larvacean house,"Larvaceans or appendicularians, class Appendicularia, are solitary, free-swimming tunicates found throughout the world's oceans. Like most tunicates, larvaceans are filter feeders.","Larvacean, Bathochordaeus, Siphonophorae, Deep sea, Leptocephalus, Gelatinous zooplankton, Kowalevskia, Mesochordaeus, Appendicularia (animal genus), Fritillaria (tunicate)"
1173,Larval Sampler,"Ichthyoplankton (from Greek: ἰχθύς, ikhthus, ""fish""; and πλαγκτός, planktos, ""drifter"") are the eggs and larvae of fish. They are mostly found in the sunlit zone of the water column, less than 200 metres deep, which is sometimes called the epipelagic or photic zone.","Ichthyoplankton, British Mid-Ocean Ridge Initiative, Cuneiform Records discography, Coral reef, Benthic-pelagic coupling, CalCOFI, Gilt darter, Stuart Bogie"
1174,Laser Raman,"Raman spectroscopy () (named after Indian physicist C. V. Raman) is a spectroscopic technique typically used to determine vibrational modes of molecules, although rotational and other low-frequency modes of systems may also be observed. Raman spectroscopy is commonly used in chemistry to provide a structural fingerprint by which molecules can be identified.","Raman spectroscopy, Raman laser, Raman scattering, Raman microscope, List of laser types, C. V. Raman, Spectroscopy, Optical amplifier, List of laser applications, Laser"
1175,Latreillia metanesa,"Latreillia is a genus of crabs in the family Latreilliidae, comprising five species:","Latreillia, Latreillia elegans, Austin B. Williams, Latreilliidae"
1176,Latrunculia (Latrunculia) austini,"Latrunculia is a genus of demosponges. It is well known for the diverse array of chemical compounds found in its species, including the latrunculins, which are named after this genus.","Latrunculia, Ceramaster patagonicus"
1177,Leachia danae,Leachia danae is a species of glass squid first described in 1931 in the Eastern tropical Pacific Ocean. It has since also been observed off the Mexican Pacific coast.,"Leachia, Cranchiinae, List of least concern molluscs, Cephalopod dermal structures, List of data deficient invertebrates, List of data deficient molluscs"
1178,Lebbeus,"Lebbeus is a genus of shrimp in the family Thoridae. It includes a species whose name was auctioned in 2009 to raise funds for conservation; Luc Longley won with a bid of A$3,600.","Lebbeus Woods, Jude the Apostle, Lebbeus clarehannah, Lebbeus groenlandicus, Lebbeus H. Rogers, 12 Monkeys, Edward Hordern, Visionary architecture, Lebbeus Bailey"
1179,Lebbeus sp.,"Lebbeus is a genus of shrimp in the family Thoridae. It includes a species whose name was auctioned in 2009 to raise funds for conservation; Luc Longley won with a bid of A$3,600.","Lebbeus, Jenner House, List of Latin and Greek words commonly used in systematic names, Kemp Caldera, Babworth House, DAIM, List of governors of Vermont, Yonaguni Knoll IV, Thoridae, Deaths in October 2012"
1180,ledge,A ledger is a book or collection of accounts in which accounting transactions are recorded. Each account has:,"Ledge, The Ledge, Dancing Ledge, Platform 7, The Ledge (film), Grand Ledge, Michigan, Man on a Ledge, Off the Ledge, Minot's Ledge Light, Campbell's Ledge"
1181,Lefroyella,"Lefroyella is a genus of glass sponges in the subfamily Euretinae, containing 2 species.","Euretinae, Euretidae, Hexasterophora, List of prehistoric sponge genera, Sceptrulophora"
1182,Lefroyella sp.,Euretinae is a subfamily of glass sponges in the family Euretidae.,Euretinae
1183,Leiodermatium,Azoricidae is a family of marine sponges belonging to the order of Tetractinellida.,"Azoricidae, Ludwig Karl Georg Pfeiffer, List of prehistoric sponge genera"
1184,Leiopathes,Leiopathes is a genus of hexacorallians belonging to the anthozoan clade Antipatharia. It is the only genus in the Leiopathidae family.,"Leiopathes glaberrima, Black coral, List of longest-living organisms, Anthozoa, Brychionoe, List of prehistoric hexacoral genera, Anton Dohrn Seamount"
1185,Leiopathes annosa,Leiopathes is a genus of hexacorallians belonging to the anthozoan clade Antipatharia. It is the only genus in the Leiopathidae family.,Leiopathes
1186,Lensia,"Lenasia, also known as Lenz, is a suburb south of Soweto in the Gauteng province, South Africa, originally created to house Indians. It is part of the City of Johannesburg Metropolitan Municipality.","Diphyidae, María de los Ángeles Alvariño González, Calycophorae, List of marine cnidarians of South Africa"
1187,Lensia achilles,"Lenasia, also known as Lenz, is a suburb south of Soweto in the Gauteng province, South Africa, originally created to house Indians. It is part of the City of Johannesburg Metropolitan Municipality.","Lensia, Diphyidae, María de los Ángeles Alvariño González, List of marine cnidarians of South Africa"
1188,Lensia conoidea,"Lenasia, also known as Lenz, is a suburb south of Soweto in the Gauteng province, South Africa, originally created to house Indians. It is part of the City of Johannesburg Metropolitan Municipality.","Lensia, Diphyidae, List of marine cnidarians of South Africa"
1189,Lensia multicristata,"Lenasia, also known as Lenz, is a suburb south of Soweto in the Gauteng province, South Africa, originally created to house Indians. It is part of the City of Johannesburg Metropolitan Municipality.","Lensia, Diphyidae, List of marine cnidarians of South Africa"
1190,Lepidion,Lepidion is a genus of morid cods.,"Small-headed cod, Cod, North Atlantic codling, List of fish of the Mediterranean Sea, List of Latin and Greek words commonly used in systematic names, Moridae, Noroit Seamount, List of least concern fishes, List of fish of Ireland"
1191,Lepidisis,Lepidisis is a genus of deep-sea bamboo coral in the family Isididae.,Bamboo coral
1192,Lepidopora,Stylasteridae is a family of hydrozoans.,"Stylasteridae, 2019 in paleontology"
1193,Lepidopora n.,"Paleontology or palaeontology is the study of prehistoric life forms on Earth through the examination of plant and animal fossils. This includes the study of body fossils, tracks (ichnites), burrows, cast-off parts, fossilised feces (coprolites), palynomorphs and chemical residues.",2019 in paleontology
1194,Lepidopsetta bilineata,"The rock sole (Lepidopsetta bilineata), also known as the Pacific rock sole or Southern rock sole is a flatfish of the family Pleuronectidae. It is a demersal fish that lives on sand and gravel bottoms at depths of up to 575 metres (1,886 ft), though it is most commonly found between 0 and 183 metres (0 and 600 ft).","Rock sole, Lepidopsetta, Northern rock sole, List of fishes of the Salish Sea"
1195,Lepidotheca hebetis,,
1196,Leptocephalus-2,"Leptocephalus (meaning ""slim head"") is the flat and transparent larva of the eel, marine eels, and other members of the superorder Elopomorpha. This is one of the most diverse groups of teleosts, containing 801 species in 4 orders, 24 families, and 156 genera.","Leptocephalus, Leptocephalus (genus), Eel life history, Bluehead chub, Bandtooth conger, Cerioporus leptocephalus, Hylaeus leptocephalus, Benthophilus leptocephalus, American eel, Giant leptocephalus"
1197,Leptogorgia,"Leptogorgia is a genus of soft coral in the family Gorgoniidae.  The genus has a widespread distribution with members being found in the eastern Atlantic Ocean from Western Europe to South Africa, the Mediterranean Sea, the Atlantic coasts of North and South America, the Antilles and the Pacific coast of America.","Leptogorgia virgulata, Leptogorgia sarmentosa, Leptogorgia capensis, Leptogorgia festiva, Leptogorgia exigua, Leptogorgia hebes, Palmate sea fan, Medusa, Cnidaria"
1198,Leptothecata,"Leptothecata, or thecate hydroids, are an order of hydrozoans in the phylum Cnidaria. Their closest living relatives are the athecate hydroids, which are similar enough to have always been considered closely related, and the very apomorphic Siphonophorae, which were placed outside the ""Hydroida"".","Hydrozoa, Hydroidolina, Aequorea victoria, Jellyfish, Obelia, Siphonophorae, Medusozoa, Laodicea undulata, Laodicea (cnidarian)"
1199,Leucicorus,"Leucicorus is a small genus of cusk-eels found in deep oceanic waters. It contains two species, one from the western Atlantic and the other from the eastern Pacific.","Cusk-eel, Blind fish, Neobythitinae"
1200,Leucicorus atlanticus,"Leucicorus is a small genus of cusk-eels found in deep oceanic waters. It contains two species, one from the western Atlantic and the other from the eastern Pacific.",Leucicorus
1201,Leucicorus lusciosus,"Leucicorus is a small genus of cusk-eels found in deep oceanic waters. It contains two species, one from the western Atlantic and the other from the eastern Pacific.","Leucicorus, Blind fish"
1202,Leuckartiara,Leuckartiara is a genus of cnidarians belonging to the family Pandeidae.The genus has cosmopolitan distribution.Species:,"Diplulmaris antarctica, Benthocodon, Pandeidae, Clione antarctica, Desmonema (cnidarian), Limacina rangii, Solmundella, List of marine cnidarians of South Africa, List of cnidarians of Ireland"
1203,Leuroglossus stilbius,"The southern smoothtongue or California smoothtongue (Leuroglossus stilbius) is a type of ray-finned fish in the deep-sea smelt family Bathylagidae, that can grow to a length of 15 centimetres (6 in) TL. This fish is native to the northeastern Pacific Ocean from British Columbia to Oregon, and the Gulf of California where it is found at depths of 100 to 850 metres (300 to 2,800 ft).",Leuroglossus
1204,Lillipathes,Schizopathidae is a family of corals belonging to the order Antipatharia.,"Schizopathidae, Black coral"
1205,Lilyopsis,"In Greek mythology, Medusa (; Ancient Greek: Μέδουσα, romanized: Médousa, lit. 'guardian, protectress'), also called Gorgo, was one of the three Gorgons. Medusa is generally described as a human female with living venomous snakes in place of hair; those who gazed into her eyes would turn to stone.","Medusa, Prayidae"
1206,Lilyopsis fluoracantha,,
1207,Limidae,"The Limidae or file shells are members of the only family of bivalve molluscs in the order Limida. The family includes 130 living species, assigned to 10 genera.","Clam, Ctenoides ales, Ctenoides scaber, Scallop, Pteriomorphia, Permian–Triassic extinction event, Triassic–Jurassic extinction event, Limaria fragilis, Lima lima"
1208,line,,"Line, Line–line intersection, A-line, A-A line, Lineman (gridiron football), Blue Line (withdrawal line), On the Line, Purple Line (ceasefire line), Line by Line, Central line"
1209,Linopneustes,Eurypatagidae is a family of echinoderms belonging to the order Spatangoida.Genera:,Eurypatagidae
1210,Liopropoma fasciatum,"Liopropoma  is a genus  of marine ray-finned fish, related to the groupers and included in the subfamily Epinephelinae, part of the family Serranidae, which also includes the anthias and sea basses. They are sometimes seen in the marine aquarium trade.","Liopropoma, List of least concern perciform fishes, William Bussing, List of data deficient fishes, List of reef fish of the Red Sea, List of fishes of the Coral Sea"
1211,Liopropoma longilepis,"Liopropoma  is a genus  of marine ray-finned fish, related to the groupers and included in the subfamily Epinephelinae, part of the family Serranidae, which also includes the anthias and sea basses. They are sometimes seen in the marine aquarium trade.","Liopropoma, List of data deficient fishes"
1212,Liopropoma maculatum,"Liopropoma  is a genus  of marine ray-finned fish, related to the groupers and included in the subfamily Epinephelinae, part of the family Serranidae, which also includes the anthias and sea basses. They are sometimes seen in the marine aquarium trade.","Liopropoma, List of data deficient fishes, List of least concern perciform fishes"
1213,Liparidae,"The snailfishes or sea snails are a family of marine ray-finned fishes. These fishes make up the Liparidae, which is classified within the order Scorpaeniformes.Widely distributed from the Arctic to Antarctic Oceans, including the oceans in between, the snailfish family contains more than 30 genera and about 410 described species, but there are also many undescribed species.","Snailfish, Lymantriinae, Pseudoliparis swirei, Pseudoliparis belyaevi, Pseudoliparis amblystomopsis, Trimethylamine N-oxide, Cyclopteroidea, Careproctus shigemii, King crab, Hardhead snailfish"
1214,Liponema,"Liponema is a genus of sea anemones, in the family Liponematidae.","Liponema brevicorne, Liponematidae, List of marine cnidarians of South Africa"
1215,Liponema brevicorne,"Liponema brevicorne, commonly known as pom-pom anemone or tentacle shedding anemone, is a species of sea anemone in the family Actiniidae. It is a deep water species and has been relatively little observed.",Liponema
1216,Lithodes couesi,"King crabs are a taxon of decapod crustaceans that are chiefly found in cold seas. Because of their large size and the taste of their meat, many species are widely caught and sold as food with the most common being the red king crab (Paralithodes camtschaticus).","Lithodes, King crab, Alaskan king crab fishing"
1217,Lithodes longispina,Lithodes longispina is a species of king crab. It has been found in Japan and Taiwan.,"Lithodes, King crab, Lithodes megacantha, Lithodes aotearoa, List of Atlantic decapod species"
1218,Lithodidae,"King crabs are a taxon of decapod crustaceans that are chiefly found in cold seas. Because of their large size and the taste of their meat, many species are widely caught and sold as food with the most common being the red king crab (Paralithodes camtschaticus).","King crab, Anomura, Lithodes santolla, Hermit crab, Carcinisation, Lithodes aequispinus, Lithodes turritus, Red king crab, Sculptolithodes, Snailfish"
1219,Lithodoidea,"King crabs are a taxon of decapod crustaceans that are chiefly found in cold seas. Because of their large size and the taste of their meat, many species are widely caught and sold as food with the most common being the red king crab (Paralithodes camtschaticus).","King crab, Hermit crab, Decapoda, Coenobitidae, Hairy stone crab, Squat lobster, Caribbean hermit crab, Paguridae, Furry lobster, Anomura"
1220,Lonchiphora,Lonchiphora is a genus of glass sponge in the family Farreidae.,Farreidae
1221,Lophaster,Lophaster is a genus of starfish within the family Solasteridae.,"Solasteridae, List of prehistoric starfish genera, List of prehistoric echinoderm genera"
1222,Lophaster furcilliger,Lophaster is a genus of starfish within the family Solasteridae.,Lophaster
1223,Lophaster sp.,,
1224,Lophiiformes,"The anglerfish are fish of the teleost order Lophiiformes (). They are bony fish named for their characteristic mode of predation, in which a modified luminescent fin ray (the esca or illicium) acts as a lure for other fish.","Anglerfish, Frogfish, List of fish of the Mediterranean Sea, Handfish, Coffinfish, List of animals of Long Island Sound, List of fish in Sweden, Footballfish, Black seadevil, Actinopterygii"
1225,Lophiodes,Lophiodes is a genus of goosefishes. It is one of four extant genera in the family Lophiidae.,"Goosefish, Lophiodes beroe, Anglerfish, Tarava Seamounts, List of fishes of India, List of least concern fishes, List of data deficient fishes, 2019 in paleoichthyology, List of marine bony fishes of South Africa"
1226,Lophiodes beroe,Lophiodes beroe is a deep water dwelling fish that is elusive and does not have many remarkable traits. There is no common name for this fish yet.This species reaches a length of 40 cm (16 in).,Lophiodes
1227,Lophiodes caulinaris,Lophiodes is a genus of goosefishes. It is one of four extant genera in the family Lophiidae.,"Lophiodes, List of least concern fishes"
1228,Lophiodes endoi,Lophiodes is a genus of goosefishes. It is one of four extant genera in the family Lophiidae.,"Lophiodes, 2019 in paleoichthyology"
1229,Lophiodes miacanthus,Lophiodes is a genus of goosefishes. It is one of four extant genera in the family Lophiidae.,Lophiodes
1230,Lophocalyx,Lanuginellinae is a subfamily of glass sponges belonging to the family Rossellidae.,"Lanuginellinae, Rossellidae"
1231,Lottiidae,"Lottiidae is a family of sea snails, specifically true limpets, marine gastropod mollusks in the superfamily Lottioidea and the clade Patellogastropoda (according to the taxonomy of the Gastropoda by Bouchet & Rocroi, 2005).","Discurria, IUCN Red List of extinct species, Lottioidea, Patellogastropoda, Lottia lindbergi, Patelloida alticostata, Radula, Acmaea mitra, Patelloida nigrosulcata"
1232,LRJ complex,This is a list of railway stations in India. The railway operations are managed by Indian Railways (IR) in the country.,"List of railway stations in India, Drop Trio"
1233,Luciobrotula,Luciobrotula is a genus of cusk-eels.,"Luciobrotula brasiliensis, Luciobrotula corethromycter, Luciobrotula lineata, Luciobrotula coheni, Luciobrotula nolfi, Luciobrotula bartschi, Cusk-eel, Noroit Seamount, List of least concern fishes"
1234,Luciobrotula sp. A,"Noroit Seamount is a seamount in the Caribbean Sea, in the Anegada Passage.  It is also spelled Noroît Seamount after the French survey and research vessel RV Le Noroît (IMO number: 7035717) which was operated by IFREMER. It is also known as Noroit Knoll.","Noroit Seamount, Helicometra, List of data deficient fishes, List of marine bony fishes of South Africa"
1235,Luidia foliolata,"Luidia foliolata, the sand star, is a species of starfish in the family Luidiidae found in the northeastern Pacific Ocean on sandy and muddy seabeds at depths to about 600 m (2,000 ft).","Luidia, Starfish, Animal locomotion, Cucumaria miniata, Echinoderm, Phyllochaetopterus prolifica, Heceta Bank"
1236,Lumpenus sagitta,Lumpenus is a genus of marine ray-finned fishes belonging to the family Stichaeidae.The genus was first proposed by Reinhardt in 1836.,"Lumpenus, List of fishes of the Salish Sea"
1237,Lutjanus argentiventris,"Lutjanus is a genus of marine ray-finned fish, snappers belonging to the family Lutjanidae. They are found in the Atlantic, Indian, and Pacific Oceans.","Lutjanus, Costa Chica of Guerrero, List of least concern perciform fishes, Abudefduf troschelii"
1238,Lutjanus guttatus,"Lutjanus is a genus of marine ray-finned fish, snappers belonging to the family Lutjanidae. They are found in the Atlantic, Indian, and Pacific Oceans.","Lutjanus, Isopoda, Cymothoa exigua, Fish disease and parasites, Cymothoidae, Fishery cooperative, List of least concern perciform fishes, List of fish of the Mediterranean Sea, List of fishes of India, List of reef fish of the Red Sea"
1239,Lycenchelys,"Lycenchelys is a genus of marine ray-finned fishes belonging to the family Zoarcidae, the eelpouts. The genus has almost cosmopolitan distribution.","Lycenchelys muraena, Lycenchelys sarsii, Lycenchelys alba, Eelpout, List of fishes of Great Britain, Vitiaziella, List of fish of Ireland, David Starr Jordan, List of fish in Sweden"
1240,Lycenchelys crotalinus,"Lycenchelys is a genus of marine ray-finned fishes belonging to the family Zoarcidae, the eelpouts. The genus has almost cosmopolitan distribution.",Lycenchelys
1241,Lycenchelys sp. 1,"The eelpouts are the ray-finned fish family Zoarcidae. As the common name suggests, they are somewhat eel-like in appearance.","Eelpout, List of data deficient fishes"
1242,Lychnagalma,"Siphonophorae (from Greek siphōn 'tube' + pherein 'to bear') is an order within Hydrozoa, which is a class of marine organisms within the phylum Cnidaria. According to the World Register of Marine Species, the order contains 175 species thus far.Siphonophores are highly polymorphic and complex organisms.","Siphonophorae, Agalmatidae"
1243,Lychnagalma utricularia,"Siphonophorae (from Greek siphōn 'tube' + pherein 'to bear') is an order within Hydrozoa, which is a class of marine organisms within the phylum Cnidaria. According to the World Register of Marine Species, the order contains 175 species thus far.Siphonophores are highly polymorphic and complex organisms.","Siphonophorae, Agalmatidae"
1244,Lycodapus,"Lycodapus is a genus of marine ray-finned fishes belonging to the family Zoarcidae, the eelpouts. The species in this genus are found in the Pacific and Southern Oceans.","Eelpout, List of fishes of the Salish Sea, Bothrocarina, Bothrocara, Lycodinae, Lycogrammoides"
1245,Lycodapus fierasfer,"Lycodapus is a genus of marine ray-finned fishes belonging to the family Zoarcidae, the eelpouts. The species in this genus are found in the Pacific and Southern Oceans.",Lycodapus
1246,Lycodapus mandibularis,"Lycodapus is a genus of marine ray-finned fishes belonging to the family Zoarcidae, the eelpouts. The species in this genus are found in the Pacific and Southern Oceans.","Lycodapus, List of fishes of the Salish Sea"
